{
  "autonomous": false,
  "blocked": false,
  "decision_hash": "1387b301b299770c5b994767bdfb224ffa5d47a3a852a34e94d249f3aa89b240",
  "delivery": {
    "id": "PR-ENT-OBSERVABILITY",
    "kind": "pull_request",
    "profile_hash": "8ded0a39b0089cb963d9f12c1ea7ea6e591cdecaa70e3dcf41dad7fff9375236",
    "profile_id": "AUT-PR-ENT-OBSERVABILITY"
  },
  "effective_level": "checkpointed",
  "evaluated_at": "2026-07-18T11:35:51.081Z",
  "execution_status": "checkpoint_required",
  "hash_algorithm": "sha256:stable-json:v1",
  "id": "AUT-DEC-20260718113550868-51e397",
  "kind": "autonomy_decision",
  "material_drift": [],
  "phase": "implementation",
  "reason_codes": [
    "authority.audit_only_caps_autonomy",
    "autonomy.contract_exceeds_delivery",
    "autonomy.delivery_exceeds_requirement",
    "delivery.authority.audit_only_caps_autonomy",
    "requirement.authority.audit_only_caps_autonomy"
  ],
  "requested_level": "bounded-autonomous",
  "requires_checkpoint": true,
  "requires_human_approval": false,
  "schema_version": "autonomy-decision:v1",
  "source_constraints": [
    {
      "blocked": false,
      "level": "checkpointed",
      "reason_codes": [
        "authority.audit_only_caps_autonomy"
      ],
      "source": "host",
      "valid": true
    },
    {
      "blocked": false,
      "level": "bounded-autonomous",
      "reason_codes": [],
      "source": "project",
      "valid": true
    },
    {
      "blocked": false,
      "level": "checkpointed",
      "reason_codes": [
        "requirement.authority.audit_only_caps_autonomy"
      ],
      "source": "requirement:AUT-REQ-ENTERPRISE-CONTROL-PLANE-001-R2-R2",
      "valid": true
    },
    {
      "blocked": false,
      "level": "checkpointed",
      "reason_codes": [
        "delivery.authority.audit_only_caps_autonomy"
      ],
      "source": "delivery",
      "valid": true
    },
    {
      "blocked": false,
      "level": "bounded-autonomous",
      "reason_codes": [],
      "source": "contract",
      "valid": true
    },
    {
      "blocked": false,
      "level": "bounded-autonomous",
      "reason_codes": [],
      "source": "capability",
      "valid": true
    },
    {
      "blocked": false,
      "level": "bounded-autonomous",
      "reason_codes": [],
      "source": "environment",
      "valid": true
    },
    {
      "blocked": false,
      "level": "bounded-autonomous",
      "reason_codes": [],
      "source": "budget",
      "valid": true
    }
  ],
  "version": 1
}
