{
  "autonomous": false,
  "blocked": false,
  "decision_hash": "f40beaf1182ed13ffce63151a9c586e86c2fc3b101a3103c8c0f2744b567ebbd",
  "delivery": {
    "id": "PR-LOCAL-RUNTIME-HARDENING-R1",
    "kind": "pull_request",
    "profile_hash": "339bda092104f4788d91e295afed9f6a38bb8f88f82b4c288e820f8e7fc6db2e",
    "profile_id": "AUT-PR-LOCAL-RUNTIME-HARDENING-R1"
  },
  "effective_level": "checkpointed",
  "evaluated_at": "2026-07-29T21:09:19.105Z",
  "execution_status": "checkpoint_required",
  "hash_algorithm": "sha256:stable-json:v1",
  "id": "AUT-DEC-20260729210918900-b13606",
  "kind": "autonomy_decision",
  "material_drift": [],
  "phase": "implementation",
  "reason_codes": [
    "authority.audit_only_caps_autonomy",
    "delivery.authority.audit_only_caps_autonomy",
    "requirement.authority.audit_only_caps_autonomy"
  ],
  "requested_level": "checkpointed",
  "requires_checkpoint": true,
  "requires_human_approval": false,
  "schema_version": "autonomy-decision:v1",
  "source_constraints": [
    {
      "blocked": false,
      "level": "checkpointed",
      "reason_codes": [
        "authority.audit_only_caps_autonomy"
      ],
      "source": "host",
      "valid": true
    },
    {
      "blocked": false,
      "level": "bounded-autonomous",
      "reason_codes": [],
      "source": "project",
      "valid": true
    },
    {
      "blocked": false,
      "level": "checkpointed",
      "reason_codes": [
        "requirement.authority.audit_only_caps_autonomy"
      ],
      "source": "requirement:AUT-REQ-ENTERPRISE-CONTROL-PLANE-001-R4-R4",
      "valid": true
    },
    {
      "blocked": false,
      "level": "checkpointed",
      "reason_codes": [
        "delivery.authority.audit_only_caps_autonomy"
      ],
      "source": "delivery",
      "valid": true
    },
    {
      "blocked": false,
      "level": "checkpointed",
      "reason_codes": [],
      "source": "contract",
      "valid": true
    },
    {
      "blocked": false,
      "level": "checkpointed",
      "reason_codes": [],
      "source": "capability",
      "valid": true
    },
    {
      "blocked": false,
      "level": "checkpointed",
      "reason_codes": [],
      "source": "environment",
      "valid": true
    },
    {
      "blocked": false,
      "level": "checkpointed",
      "reason_codes": [],
      "source": "budget",
      "valid": true
    }
  ],
  "version": 1
}
