{
  "autonomous": false,
  "blocked": false,
  "decision_hash": "694e419e3029d5477982f774cd3355299e46ca67dc0349304b2e89e0180efc90",
  "delivery": {
    "id": "PR-ENT-RELEASE-R1",
    "kind": "pull_request",
    "profile_hash": "966d3f78becca0afacd6f17e255fb9cafc00a43e29611f78a1d3eb4e5dde555b",
    "profile_id": "AUT-PR-ENT-RELEASE-R1"
  },
  "effective_level": "checkpointed",
  "evaluated_at": "2026-07-19T03:26:32.355Z",
  "execution_status": "checkpoint_required",
  "hash_algorithm": "sha256:stable-json:v1",
  "id": "AUT-DEC-20260719032632170-b19d35",
  "kind": "autonomy_decision",
  "material_drift": [],
  "phase": "implementation",
  "reason_codes": [
    "authority.audit_only_caps_autonomy",
    "autonomy.contract_exceeds_delivery",
    "autonomy.delivery_exceeds_requirement",
    "delivery.authority.audit_only_caps_autonomy",
    "requirement.authority.audit_only_caps_autonomy"
  ],
  "requested_level": "bounded-autonomous",
  "requires_checkpoint": true,
  "requires_human_approval": false,
  "schema_version": "autonomy-decision:v1",
  "source_constraints": [
    {
      "blocked": false,
      "level": "checkpointed",
      "reason_codes": [
        "authority.audit_only_caps_autonomy"
      ],
      "source": "host",
      "valid": true
    },
    {
      "blocked": false,
      "level": "bounded-autonomous",
      "reason_codes": [],
      "source": "project",
      "valid": true
    },
    {
      "blocked": false,
      "level": "checkpointed",
      "reason_codes": [
        "requirement.authority.audit_only_caps_autonomy"
      ],
      "source": "requirement:AUT-REQ-ENT-RELEASE-R1-R1",
      "valid": true
    },
    {
      "blocked": false,
      "level": "checkpointed",
      "reason_codes": [
        "delivery.authority.audit_only_caps_autonomy"
      ],
      "source": "delivery",
      "valid": true
    },
    {
      "blocked": false,
      "level": "bounded-autonomous",
      "reason_codes": [],
      "source": "contract",
      "valid": true
    },
    {
      "blocked": false,
      "level": "bounded-autonomous",
      "reason_codes": [],
      "source": "capability",
      "valid": true
    },
    {
      "blocked": false,
      "level": "bounded-autonomous",
      "reason_codes": [],
      "source": "environment",
      "valid": true
    },
    {
      "blocked": false,
      "level": "bounded-autonomous",
      "reason_codes": [],
      "source": "budget",
      "valid": true
    }
  ],
  "version": 1
}
