{
  "autonomous": false,
  "blocked": false,
  "decision_hash": "e3ecc1744584a1a107c32c01abafaf024c3ccf1a823ce44ed853f3dee4d4d3c8",
  "delivery": {
    "id": "PR-ENT-CI-PERF-R1",
    "kind": "pull_request",
    "profile_hash": "999448d997cc78b1951d3436c2e98f4e8b59d0dee462cc97f167696a71772db3",
    "profile_id": "AUT-PR-ENT-CI-PERF-R1"
  },
  "effective_level": "checkpointed",
  "evaluated_at": "2026-07-19T06:00:14.712Z",
  "execution_status": "checkpoint_required",
  "hash_algorithm": "sha256:stable-json:v1",
  "id": "AUT-DEC-20260719060014692-9319f1",
  "kind": "autonomy_decision",
  "material_drift": [],
  "phase": "implementation",
  "reason_codes": [
    "authority.audit_only_caps_autonomy",
    "autonomy.contract_exceeds_delivery",
    "autonomy.delivery_exceeds_requirement",
    "delivery.authority.audit_only_caps_autonomy",
    "requirement.authority.audit_only_caps_autonomy"
  ],
  "requested_level": "bounded-autonomous",
  "requires_checkpoint": true,
  "requires_human_approval": false,
  "schema_version": "autonomy-decision:v1",
  "source_constraints": [
    {
      "blocked": false,
      "level": "checkpointed",
      "reason_codes": [
        "authority.audit_only_caps_autonomy"
      ],
      "source": "host",
      "valid": true
    },
    {
      "blocked": false,
      "level": "bounded-autonomous",
      "reason_codes": [],
      "source": "project",
      "valid": true
    },
    {
      "blocked": false,
      "level": "checkpointed",
      "reason_codes": [
        "requirement.authority.audit_only_caps_autonomy"
      ],
      "source": "requirement:AUT-REQ-ENT-RELEASE-R1-R1",
      "valid": true
    },
    {
      "blocked": false,
      "level": "checkpointed",
      "reason_codes": [
        "delivery.authority.audit_only_caps_autonomy"
      ],
      "source": "delivery",
      "valid": true
    },
    {
      "blocked": false,
      "level": "bounded-autonomous",
      "reason_codes": [],
      "source": "contract",
      "valid": true
    },
    {
      "blocked": false,
      "level": "bounded-autonomous",
      "reason_codes": [],
      "source": "capability",
      "valid": true
    },
    {
      "blocked": false,
      "level": "bounded-autonomous",
      "reason_codes": [],
      "source": "environment",
      "valid": true
    },
    {
      "blocked": false,
      "level": "bounded-autonomous",
      "reason_codes": [],
      "source": "budget",
      "valid": true
    }
  ],
  "version": 1
}
