{
  "autonomous": false,
  "blocked": false,
  "decision_hash": "59f983ff6d380cba206db79efe12368729c2d30c4d80d748009f61f7cb94d526",
  "delivery": {
    "id": "PR-NOVICE-PLUGIN-JOURNEY-001",
    "kind": "pull_request",
    "profile_hash": "fed96d591deb92b91e7b9334661d6773dc2b24908262c3740d0e92cf5c0ca3a9",
    "profile_id": "AUT-PR-NOVICE-PLUGIN-JOURNEY-002"
  },
  "effective_level": "checkpointed",
  "evaluated_at": "2026-07-26T18:17:02.487Z",
  "execution_status": "checkpoint_required",
  "hash_algorithm": "sha256:stable-json:v1",
  "id": "AUT-DEC-20260726181702479-592f6f",
  "kind": "autonomy_decision",
  "material_drift": [],
  "phase": "design",
  "reason_codes": [
    "authority.audit_only_caps_autonomy",
    "autonomy.contract_exceeds_delivery",
    "autonomy.delivery_exceeds_requirement",
    "delivery.authority.audit_only_caps_autonomy",
    "requirement.authority.audit_only_caps_autonomy"
  ],
  "requested_level": "bounded-autonomous",
  "requires_checkpoint": true,
  "requires_human_approval": false,
  "schema_version": "autonomy-decision:v1",
  "source_constraints": [
    {
      "blocked": false,
      "level": "checkpointed",
      "reason_codes": [
        "authority.audit_only_caps_autonomy"
      ],
      "source": "host",
      "valid": true
    },
    {
      "blocked": false,
      "level": "bounded-autonomous",
      "reason_codes": [],
      "source": "project",
      "valid": true
    },
    {
      "blocked": false,
      "level": "checkpointed",
      "reason_codes": [
        "requirement.authority.audit_only_caps_autonomy"
      ],
      "source": "requirement:AUT-REQ-ENTERPRISE-CONTROL-PLANE-001-R2-R2",
      "valid": true
    },
    {
      "blocked": false,
      "level": "checkpointed",
      "reason_codes": [
        "delivery.authority.audit_only_caps_autonomy"
      ],
      "source": "delivery",
      "valid": true
    },
    {
      "blocked": false,
      "level": "bounded-autonomous",
      "reason_codes": [],
      "source": "contract",
      "valid": true
    },
    {
      "blocked": false,
      "level": "bounded-autonomous",
      "reason_codes": [],
      "source": "capability",
      "valid": true
    },
    {
      "blocked": false,
      "level": "bounded-autonomous",
      "reason_codes": [],
      "source": "environment",
      "valid": true
    },
    {
      "blocked": false,
      "level": "bounded-autonomous",
      "reason_codes": [],
      "source": "budget",
      "valid": true
    }
  ],
  "version": 1
}
