{
  "autonomous": false,
  "blocked": false,
  "decision_hash": "e0b9e38812fa19d384065f0f2d513afe96e0447e2e106cc5e43ffb626e4dc2a9",
  "delivery": {
    "id": "PR-ENT-PORTFOLIO-R4",
    "kind": "pull_request",
    "profile_hash": "ebd7ef768dbad2ddbf8d8de3875b56d8b73dfb9ef53fda5da48f38f25e666dc1",
    "profile_id": "AUT-PR-ENT-PORTFOLIO-R4"
  },
  "effective_level": "checkpointed",
  "evaluated_at": "2026-07-19T01:53:26.504Z",
  "execution_status": "checkpoint_required",
  "hash_algorithm": "sha256:stable-json:v1",
  "id": "AUT-DEC-20260719015326314-c98f8b",
  "kind": "autonomy_decision",
  "material_drift": [],
  "phase": "implementation",
  "reason_codes": [
    "authority.audit_only_caps_autonomy",
    "autonomy.contract_exceeds_delivery",
    "autonomy.delivery_exceeds_requirement",
    "delivery.authority.audit_only_caps_autonomy",
    "requirement.authority.audit_only_caps_autonomy"
  ],
  "requested_level": "bounded-autonomous",
  "requires_checkpoint": true,
  "requires_human_approval": false,
  "schema_version": "autonomy-decision:v1",
  "source_constraints": [
    {
      "blocked": false,
      "level": "checkpointed",
      "reason_codes": [
        "authority.audit_only_caps_autonomy"
      ],
      "source": "host",
      "valid": true
    },
    {
      "blocked": false,
      "level": "bounded-autonomous",
      "reason_codes": [],
      "source": "project",
      "valid": true
    },
    {
      "blocked": false,
      "level": "checkpointed",
      "reason_codes": [
        "requirement.authority.audit_only_caps_autonomy"
      ],
      "source": "requirement:AUT-REQ-ENT-PORTFOLIO-R2-R2",
      "valid": true
    },
    {
      "blocked": false,
      "level": "checkpointed",
      "reason_codes": [
        "delivery.authority.audit_only_caps_autonomy"
      ],
      "source": "delivery",
      "valid": true
    },
    {
      "blocked": false,
      "level": "bounded-autonomous",
      "reason_codes": [],
      "source": "contract",
      "valid": true
    },
    {
      "blocked": false,
      "level": "bounded-autonomous",
      "reason_codes": [],
      "source": "capability",
      "valid": true
    },
    {
      "blocked": false,
      "level": "bounded-autonomous",
      "reason_codes": [],
      "source": "environment",
      "valid": true
    },
    {
      "blocked": false,
      "level": "bounded-autonomous",
      "reason_codes": [],
      "source": "budget",
      "valid": true
    }
  ],
  "version": 1
}
